{
  "cena": "s38",
  "aprovado": true,
  "gatesDuros": [],
  "lentes": [
    {
      "lente": "espaco",
      "nota": 8,
      "problemas": [
        "Quadros olhados: 0,1, 1,0, 1,6, 2,5, 3,5, 4,0, 4,6, 5,4, 6,5, 7,3, 8,5 e 9,5 s, mais os 16 quadros de 6,70 a 7,23 s (um por quadro) e recortes em resolução cheia do topo da roda. Nenhuma colisão de texto: as três fitas (84 px, --fs-eixo) ficam sobre a calculadora, e 'environmental' passa ~110 px da borda direita dela, de propósito (efeito de fita colada). Crédito em x ~200, uma linha, na faixa; canto de 400 × 400 px livre. O recibo sobe até y ~180 no 4K, dentro da margem de 160 px do topo (a ~20 px dela), e fica entre as duas cadeiras do alto.",
        "Observação: a folga entre o recibo e as duas cadeiras do alto é de ~25–30 px de cada lado (recorte de 4K de 8,5 e 9,5 s: o anel da esquerda a ~27 px da borda do recibo e o da direita a ~26 px), melhor do que a versão anterior (que encostava na da esquerda), mas ainda apertada; a regência declara o 'sobe entre as duas do alto'.",
        "Portões que mediram e passaram, sem falha nem indefinido: contrato, carga, colisão, tamanho, til-glifo, src-existe, fora-do-quadro, crédito-fantasma, pelo qc-cena de 01/10/2026, 13:11 (carimbo em out/juneau/_portao.json, hash igual ao HTML atual). O que acima é do olho não contradiz nenhum portão."
      ],
      "correcoes": [
        "Se o editor-de-arte renderizar de novo por outro motivo: abrir a roda no alto em ~20 px para cada lado (ou estreitar o recibo) para deixar ~50 px de cada lado do recibo. Dono: editor-de-arte. Não reprova."
      ],
      "origem": "julgada"
    },
    {
      "lente": "factual",
      "nota": 9,
      "problemas": [
        "Textos conferem com o textos-tela: social · economic · environmental (as três legendas, em fita de papel) e Source: Alaska State Legislature, 2026; RIGHT TO KNOW fica fora da tela (nao_vai_para_tela, R1 da regência) e o recibo em branco carrega a ideia. Nove círculos, como a voz diz ('nine-member'). Nenhuma mídia. A factualidade é do verificador-de-fatos."
      ],
      "correcoes": [],
      "origem": "julgada"
    },
    {
      "lente": "wordlock",
      "nota": 9,
      "problemas": [
        "Os nove círculos se acendem de 'nine-member' (0,9 s: nenhum em 0,1 s, dois em 1,0 s, os nove em 1,6 s); social entra em 'social' (3,77 s: ausente em 3,5 s, presente em 4,0 s), economic em 'economic' (4,33 s) e environmental em 'environmental' (5,03 s: presente em 5,4 s); o recibo em branco começa a sair da calculadora em 'The stated purpose' (6,83 s) e sobe até ~7,6 s."
      ],
      "correcoes": [],
      "origem": "julgada"
    },
    {
      "lente": "abordagem",
      "nota": 8,
      "problemas": [
        "PRANCHA de mecanismo (uma regra de lei não tem imagem real): a comissão de nove em roda, os três custos em fita e o recibo em branco do 'right to know'. Observação: a calculadora de papel lê-se mais como um bloco pautado do que como uma calculadora, e o recibo sai dela como uma fita de caixa; funciona como metáfora, e a regência diz 'ninguém fotografa uma regra'."
      ],
      "correcoes": [],
      "origem": "julgada"
    },
    {
      "lente": "acessibilidade",
      "nota": 8,
      "problemas": [
        "Em 2 s: nove círculos em roda sobre um papel e, depois, as palavras social, economic, environmental. Os círculos não dizem 'comissão' e nenhum número está na tela: o leigo conta nove porque a voz disse 'nine-member'. O recibo em branco, que fecha 'right to know', não tem palavra (decidido pela regência: ficaria 0,85 s)."
      ],
      "correcoes": [],
      "origem": "julgada"
    },
    {
      "lente": "poluicao",
      "nota": 7,
      "problemas": [
        "No teto: de 6,83 s ao fim há a roda das cadeiras (1), a calculadora (1), as três fitas (3) e o recibo (1) = 6 elementos, o teto da identidade §4.2 (a regência declara 'no teto, aceito'); a identidade diz que cena que encosta no teto está no pior extremo. Sem texto de leitura (as fitas são rótulos de uma palavra), 0 blocos.",
        "qc-carga passou (qc-cena de 01/10/2026, 13:11 (carimbo em out/juneau/_portao.json, hash igual ao HTML atual)). A contagem de elementos acima é do olho nos quadros."
      ],
      "correcoes": [],
      "origem": "julgada"
    },
    {
      "lente": "motion",
      "nota": 8,
      "problemas": [
        "O defeito da versão anterior (uma faixa de papel que aparecia abaixo da calculadora por 5 quadros e sumia para cima, antes de o recibo emergir) foi corrigido: nos 16 quadros de 6,70 a 7,23 s, o recibo aparece em 6,83 s só com a borda serrilhada acima do topo da calculadora e sobe sem salto até ~7,6 s; nada aparece abaixo dela. As cadeiras escalam em passos, as fitas entram com rotação e deslizamento, e a luz fica atrás da calculadora. Nenhum trecho de 0,5 s ou mais parado pelas métricas (a fina também), mas os trechos mais calmos são o de 1,6 a 3,7 s (2,1 s), o de 5,5 a 6,8 s (1,3 s) e o de 8,0 a 9,57 s (1,6 s), em que só há a deriva da câmera da marca (por correlação de fase, ~1 a 1,8 px/s no 4K: +1,5 e +2,9 px em x aos 2,5 e 3,5 s; de −0,8 a −2,7 px em y de 8,5 a 9,5 s). Abaixo do meu limite de 3 s para reprovar; sinaliza.",
        "qc-video-avanca: sem <video> na cena, nada a medir."
      ],
      "correcoes": [],
      "origem": "julgada"
    },
    {
      "lente": "fonte",
      "nota": 9,
      "problemas": [
        "Crédito certo para texto de lei do Estado: Source: Alaska State Legislature, 2026 na faixa, em uma linha de x ~200, do primeiro 1 s ao fim (em subida em 1,0 s), sem crédito-fantasma. Contraste que medi nos quadros de 4K: 8,84:1 (5,0 s) e 8,83:1 (9,0 s), e o do gate, 8,73:1 em 7,17 s; piso 3:1. A calculadora, as cadeiras e as fitas não precisam de crédito (arte de mecanismo).",
        "qc-credito-fantasma passou (qc-cena de 01/10/2026, 13:11 (carimbo em out/juneau/_portao.json, hash igual ao HTML atual)). qc-rodape-contraste medido em 01/10/2026 (14:49): 8.73:1 @ 7.17 s \"Source: Alaska State Legislature, 2026\", piso 3:1 (8.84:1 e 8.83:1 medidos por mim em 5,0 e 9,0 s)."
      ],
      "correcoes": [],
      "origem": "julgada"
    },
    {
      "lente": "tema",
      "nota": 9,
      "problemas": [
        "PRANCHA sobre --fundo (tokens --mesa-*), com a luz atrás da calculadora, as cadeiras em círculo de contorno claro, as fitas em --papel e Inter; nenhuma cor de marca. Sem véu."
      ],
      "correcoes": [],
      "origem": "julgada"
    },
    {
      "lente": "cobertura",
      "nota": 9,
      "problemas": [
        "Cada metade da fala tem a sua imagem: 'a nine-member commission to tally the costs, including social, economic and environmental ones' (a roda, a calculadora e as três fitas) e 'the stated purpose is the people's right to know' (o recibo em branco). A regra de lei não tem imagem real, e o recibo sem texto carrega a segunda."
      ],
      "correcoes": [],
      "origem": "julgada"
    },
    {
      "lente": "cadencia",
      "nota": 8,
      "problemas": [
        "Dois beats (6,8 s e 2,8 s), cada um com movimento próprio; o primeiro tem 6,8 s de PRANCHA, mas com entradas escalonadas (cadeiras, 3 fitas) em boa parte do tempo; o piso de 1,5 s por beat é cumprido."
      ],
      "correcoes": [],
      "origem": "julgada"
    },
    {
      "lente": "autoria",
      "nota": 10,
      "problemas": [],
      "correcoes": [],
      "origem": "julgada"
    },
    {
      "lente": "camadas",
      "nota": 10,
      "problemas": [],
      "correcoes": [],
      "origem": "julgada"
    },
    {
      "lente": "circulo",
      "nota": 8,
      "problemas": [
        "A roda de círculos e o papel pautado são formas novas no vídeo; a linha de recibo em branco volta como motivo (s02 e s35). Eco de forma com conteúdo novo."
      ],
      "correcoes": [],
      "origem": "julgada"
    }
  ]
}