{
  "cena": "s35",
  "aprovado": true,
  "gatesDuros": [],
  "lentes": [
    {
      "lente": "espaco",
      "nota": 8,
      "problemas": [
        "exceção do Lucas: qc-tamanho, crédito a 56 px (\"[tamanho] [credito] \\\"Source: Medina García, PUCP, 1982\\\" 56<72\"), 07/10/2026 11:3x (\"Quero reduzir para 56px\"), sha1 fc749e3b igual ao de qc/_excecoes-portao.json; o crédito vem de var(--fs-credito) com data-qc-papel=\"credito\", e o de mapa leva data-qc-credito=\"mapa\".",
        "portões lidos no sha1 de hoje (fc749e3b): portao-margens veredito 0 (14 itens, 214 amostras de 0,1 s, nenhum aviso; marca c647bf6c = tokens.css de hoje); portao-mapa til 0 e rodape v5 0 (12,03:1); _portao.json: falhas só `tamanho` (a exceção), til-glifo coberto pelo portao-mapa e mapa-vivo fora do portão. Nos 16 quadros do clipe 4K (0,1 a 21,1 s) nada sai da margem nem entra no canto de 400 × 400; o crédito de mapa está em todos, inclusive no meio da viagem (3,8 s).",
        "sinal (nota >= 7): em 5,0–10,8 s a cota, a pílula com o ponto e os 3 bonecos e a legenda ficam a ~30 px uns dos outros no meio do quadro (nenhuma colisão, 4 itens)."
      ],
      "correcoes": []
    },
    {
      "lente": "factual",
      "nota": 9,
      "problemas": [
        "observação: o ponto de Pamplona segue declarado (`Approximate location` na tela todo o tempo do ponto, 4,734–11,034 s) e nunca aparece `Pamplona Alta`; o polígono de Villa El Salvador é o do distrito de hoje (OSM), e a voz fecha com `That ground became Villa El Salvador`. `1971 · 180 FAMILIES` e `ABOUT 7,000 FAMILIES TO RESETTLE` batem com o textos-tela (Medina García 1982). Grafia e vírgula de milhar corretas, `García` sem tofu. O conserto da arte-14 não tocou nenhum texto."
      ],
      "correcoes": []
    },
    {
      "lente": "wordlock",
      "nota": 9,
      "problemas": [
        "tempos conferidos de novo no clipe contra o words.json (vídeo − 407,433 s): nada de texto em 4,6 s; em 5,0 s já estão `Pamplona`, `Approximate location`, a cota `1971 · 180 FAMILIES` e o crédito Medina (`In` a 4,75; `nineteen` a 4,95); a cota `ABOUT 7,000…` está em 13,5 s (`seven` a 13,27); `Villa El Salvador` está em 19,5 s (entra em 19,234, `became` a 19,19, `Villa` a 19,51: o mínimo que a regência declara). A viagem (2,933–4,733) cobre `homes at the city's edge` (`edge` a 3,91): o recuo mostra a cidade e os morros nesse trecho, e nenhum elemento de texto foi atrasado por ela, então não há re-check de word-lock a refazer."
      ],
      "correcoes": []
    },
    {
      "lente": "abordagem",
      "nota": 8,
      "problemas": [],
      "correcoes": []
    },
    {
      "lente": "acessibilidade",
      "nota": 8,
      "problemas": [
        "melhorou com a viagem: em 4,2–4,6 s o recuo mostra a costa, a malha da cidade e os morros ao redor, e `a borda de Lima` se lê pelo quadro (antes, o b0 inteiro era só a malha densa de Huaycán, nota 7). O trecho 0–2,9 s continua sem rótulo (satélite a z ~16, `cidade densa entre morros`); a voz explica (`built their own homes at the city's edge`), e o textos-tela não põe pílula ali de propósito (R10-2)."
      ],
      "correcoes": []
    },
    {
      "lente": "poluicao",
      "nota": 8,
      "problemas": [
        "b1: pílula, ponto, bonecos, cota, legenda e crédito (6 no pico, dentro do teto da identidade §4.2; 3 blocos de texto vivos no máximo); b2: polígono, grade de bonecos e cota. Sem texto órfão: cada um tem a palavra que o convoca no words.json."
      ],
      "correcoes": []
    },
    {
      "lente": "motion",
      "nota": 8,
      "problemas": [
        "a viagem de 1,8 s (2,933–4,733) no lugar do corte seco: contínua e cúbica (in-out), dentro da faixa de 1,5 a 3 s da identidade §4.4. Prova nos quadros do clipe 4K (um por 1/30 s, 480×270, diferença média de luma entre quadros vizinhos): sobe de 0,8 a ~28 em 3,8–4,2 s e desce a 0,7 em 4,733 s, sem nenhum salto (o maior valor de toda a cena é 28,1, dentro dessa curva). Não sobra corte de mapa para mapa dentro da cena: o resto (11–13 s e 19–21 s) é a câmera andando, com diferença de 3 a 13. Os quadros 3,4 / 3,8 / 4,2 / 4,6 mostram o mesmo percurso sem tile cinza.",
        "sinal (nota >= 7), a emenda da viagem: a aproximação do b0 anda a velocidade constante até 2,933 s (diferença ~8,6 por quadro) e a viagem sai do repouso; entre 2,967 e 3,07 s a diferença cai a 0,8–3,4 (uma parada de ~0,13 s) antes de subir. É um tranco leve, não um corte. Destino: `mapista`, se quiser fechar: terminar a aproximação com ease-out (ou começar a viagem já com a velocidade da aproximação) para a câmera não parar no 2,933 s.",
        "sinal, inalterado: o b1 (4,733–11 s) é um push-in lento de ~2 % (diferença ~1,0 por quadro, contínua), reconhecível como o mesmo ponto de vista; não é foto parada, e não se pede velocidade.",
        "para a emenda (fora deste lote, não olhada): a s35 termina em movimento sobre Villa El Salvador a z ~14, e a s36 é mapa; quem fizer o passo das emendas confere o corte seco s35 → s36 (identidade §4.4), que cairia nesta cena."
      ],
      "correcoes": []
    },
    {
      "lente": "fonte",
      "nota": 9,
      "problemas": [
        "`© MapTiler © OpenStreetMap contributors` está nos 16 quadros olhados (inclusive no meio da viagem), com contraste 12,03:1 (portao-mapa rodape v5); `Source: Medina García, PUCP, 1982` aparece de 5,0 a 16,0 s e some antes de 19,0 s, como o textos-tela (4,934–18,467). Sem mídia de `_media/` na cena (só geo e base), logo sem crédito de mídia e sem crédito-fantasma."
      ],
      "correcoes": []
    },
    {
      "lente": "tema",
      "nota": 9,
      "problemas": [],
      "correcoes": []
    },
    {
      "lente": "cobertura",
      "nota": 8,
      "problemas": [
        "sinal: o concreto central (casas de autoconstrução na areia) só existe como satélite; a caça não trouxe registro aéreo ou foto para s35-a nem s35-b, e nada baixado ficou de fora. Sem material a apontar."
      ],
      "correcoes": []
    },
    {
      "lente": "cadencia",
      "nota": 8,
      "problemas": [
        "sem footage. O push-in do b1 e as duas pernas de câmera (11–13 s e 19–21 s) carregam o quadro; as entradas são 4,734 / 4,934 / 13,234 / 19,234 s (no máximo 6,3 s sem entrada nova, com o ponto e a cota na tela)."
      ],
      "correcoes": []
    },
    {
      "lente": "autoria",
      "nota": 10,
      "problemas": [],
      "correcoes": []
    },
    {
      "lente": "camadas",
      "nota": 10,
      "problemas": [],
      "correcoes": []
    },
    {
      "lente": "circulo",
      "nota": 8,
      "problemas": [
        "sinal de forma: s35 (b1, satélite a z 12,6 sobre o sul de Lima), s42 (30 s) e s44 (b1, 12,5 s) são três satélites da borda de Lima; lugar, zoom e dado diferem (olhados na folha de irmãs: s34 em 18,5 s é o polígono do PIB, s36 em 3,0 s é o polígono `Lima and Callao`). A s35 é a única que lê a malha de casas, o ponto de 1971 e o polígono de Villa El Salvador; se ela sumisse, o espectador perderia a informação visual da chegada dos 180 e dos 7.000. Não reprova."
      ],
      "correcoes": []
    }
  ]
}
