{
  "cena": "s14",
  "aprovado": true,
  "gatesDuros": [],
  "lentes": [
    {
      "lente": "espaco",
      "nota": 8,
      "problemas": [
        "exceção do Lucas: qc-tamanho, crédito a 56 px, 07/10/2026 (\"Quero reduzir para 56px\"), sha1 c27ac975 igual ao de _excecoes-portao.json; portões lidos no sha1 de hoje: portao-margens veredito 0 (3 itens, 99 amostras), portao-mapa til 0 e rodape v5 0 (contraste 8,4:1), qc-hex 0, qc-janela PASS; o crédito vem de var(--fs-credito) (56 px)",
        "composição: o corte vertical ocupa a metade de baixo e o H, o alto, com a metade de cima vazia; hierarquia clara (rótulos 128 px, 'COLD SEA' sob o mar e 'WARM LID' sobre a tampa). Nenhum texto cortado."
      ],
      "correcoes": []
    },
    {
      "lente": "factual",
      "nota": 9,
      "problemas": [
        "mecanismo conforme o SENAMHI 2021 (fatos-tela TA085, TA086 CONFIRMADA): mar frio, ar que desce, tampa quente, umidade barrada, sem altitude na tela. A física se sustenta: a tampa desce em amortecimento crítico e para em 4,10 s (antes de 'lid', 4,31 s), a umidade sobe, para sob a tampa e achata em neblina (quadro 8,0 s: os fios terminam logo abaixo da segunda linha da tampa)."
      ],
      "correcoes": []
    },
    {
      "lente": "wordlock",
      "nota": 9,
      "problemas": [
        "'COLD SEA' em 0,134 s ('cold', words.json 138,19 − 138,033 = 0,16 s); setas em 'sinking' (2,47 s); tampa em 'settles' (3,1 s); 'WARM LID' em 4,3 s ('lid', 4,31 s); a umidade parte em 6,04 s ('Under') e 'moisture' é dito em 7,19 s: o desenho precede a palavra em ~1,2 s, mas o plano é o da frase."
      ],
      "correcoes": []
    },
    {
      "lente": "abordagem",
      "nota": 9,
      "problemas": [
        "ANIMAÇÃO de mecanismo no traço de engenheiro (identidade §5): a inversão térmica não tem imagem real, e o registro dela está na s13 (nuvem) e na s15 (neblina de Lima)."
      ],
      "correcoes": []
    },
    {
      "lente": "acessibilidade",
      "nota": 7,
      "problemas": [
        "leitura só do texto: 'COLD SEA' e 'WARM LID' sob e sobre duas linhas finas; o leigo entende mar frio sob uma tampa, mas a camada de ar frio (as linhas tracejadas) não tem nome e a tampa é um par de linhas de mesmo peso que as do mar. A umidade que sobe é fina, cinza e sem rótulo (a lista fechada do redator tem dois textos). A voz explica o resto.",
        "pergunta da Arte (o H): no quadro comparado, o H da s14 e o da s13 têm a mesma forma (letra H oca de traço contínuo, proporção largura/altura 0,83 contra 0,85). Diferem no tamanho (altura ~225 px contra ~123 px no 4K); o da s13 leva halo escuro e as setas em espiral, o da s14 está sobre a mesa, sem halo. É a mesma letra e a ligação se faz."
      ],
      "correcoes": [
        "opcional (editor-de-arte): igualar o tamanho do H ao da s13 (~125 px de altura) se a Sala quiser a mesma escala; não é achado."
      ]
    },
    {
      "lente": "poluicao",
      "nota": 9,
      "problemas": [
        "H, tampa, camada fria, mar, costa e 2 rótulos; em cada plano só as setas ou os fios: nunca mais de 6 elementos; nenhuma redundância."
      ],
      "correcoes": []
    },
    {
      "lente": "motion",
      "nota": 9,
      "problemas": [
        "tampa com amortecimento crítico (ω = 7/s, parada < 0,5 px em 4,10 s), setas, fios que desaceleram e param sob a tampa; fios saem de 8,70 a 9,30 s e a neblina fica; quadros de 4,6 e 5,5 s com a deriva do RIG e o texto parado. O quadro de 9,5 s é o repouso final (250 ms)."
      ],
      "correcoes": []
    },
    {
      "lente": "fonte",
      "nota": 8,
      "problemas": [
        "exceção do Lucas: qc-tamanho, crédito a 56 px, 07/10/2026 (\"Quero reduzir para 56px\"), sha1 c27ac975 igual ao de _excecoes-portao.json",
        "'Source: SENAMHI (Peru), 2021' a cena inteira (textos-tela: o mecanismo desenhado); atribuição do que é explicado, não crédito de mídia: não é supérfluo."
      ],
      "correcoes": []
    },
    {
      "lente": "tema",
      "nota": 9,
      "problemas": [
        "só traço em --tinta de 6 px sobre a mesa; nenhuma cor de lado; mesma linguagem da s13."
      ],
      "correcoes": []
    },
    {
      "lente": "cobertura",
      "nota": 8,
      "problemas": [
        "o concreto central (mar, costa, nuvem de chuva) está em registro real na s13 (mapa e imagem da NASA) e na s15 (neblina de Lima); nesta cena entra como esquema, pela abordagem."
      ],
      "correcoes": []
    },
    {
      "lente": "cadencia",
      "nota": 8,
      "problemas": [
        "dois planos de desenho encadeados (6,03 s + 3,7 s) sem corte, com um objeto novo em cada (a tampa, a umidade); o respiro de 4,3 a 6,0 s tem a deriva do RIG."
      ],
      "correcoes": []
    },
    {
      "lente": "autoria",
      "nota": 10,
      "problemas": [],
      "correcoes": []
    },
    {
      "lente": "camadas",
      "nota": 10,
      "problemas": [],
      "correcoes": []
    },
    {
      "lente": "circulo",
      "nota": 9,
      "problemas": [
        "avança em relação à s13: o mesmo H e o mesmo mar frio agora em corte vertical, com a tampa e a umidade, informação nova."
      ],
      "correcoes": []
    }
  ]
}