{
  "cena": "s27",
  "aprovado": false,
  "gatesDuros": [],
  "lentes": [
    {
      "lente": "espaco",
      "nota": 6,
      "problemas": [
        "Margem direita violada em todo o terceiro plano (≈ 9,0–12,2 s): a pílula 'WILLIAM MCKINLEY' (128 px, Inter 700) termina em x≈3746 e o texto em x≈3707–3710; o limite é x 3640 (margem de 200 px, identidade §4.1; roupa do QC, espaço). Medido por inventário do DOM em 11,0 s e 12,1 s: 106 px além da margem, com o texto a ~130 px da borda do quadro. O gate de colisão e o fora-do-quadro ficaram verdes porque o texto cabe no quadro; a margem é lei da marca, não do gate.",
        "O resto cabe: cargo em duas linhas (84 px) até y≈1872 (< 1880), canto inferior direito livre, nenhum texto sobre texto."
      ],
      "correcoes": [
        "Recuar o conjunto do card (foto impressa + 'Photo from 1898' + nome + cargo) pelo menos 110 px para a esquerda, de modo que a pílula do nome termine em x ≤ 3640; há folga: o cartaz termina em x≈1600 e o card começa em x≈2400. Não encolher o nome (piso do rótulo 128).",
        "Conferir no último quadro do render (12,1 s), com a câmera na escala final (editor-de-arte §4: a margem vale em todo quadro, sob a câmera)."
      ]
    },
    {
      "lente": "factual",
      "nota": 9,
      "problemas": [],
      "correcoes": []
    },
    {
      "lente": "wordlock",
      "nota": 8,
      "problemas": [
        "Observação: 'APRIL 26, 1899' (rótulo) entra em 'April' e a legenda 'Free Harbor Jubilee' em 'Jubilee' (6,3 s); o card de McKinley pousa só quando a voz diz o nome (≈ 8,8 s), com nome, cargo e aviso 150 e 120 ms depois do assentamento. Nada entra antes da fala que o convoca."
      ],
      "correcoes": []
    },
    {
      "lente": "abordagem",
      "nota": 9,
      "problemas": [],
      "correcoes": []
    },
    {
      "lente": "acessibilidade",
      "nota": 8,
      "problemas": [],
      "correcoes": []
    },
    {
      "lente": "poluicao",
      "nota": 7,
      "problemas": [
        "Observação: a legenda 'Free Harbor Jubilee' repete o título já impresso em letras vermelhas no cartaz, e 'APRIL 26, 1899' repete a data impressa ('April 26 and 27, 1899'). Passam no teste de lastro ('Jubilee' e 'April' convocam), mas a legenda é redundante com o cartaz."
      ],
      "correcoes": [
        "Se for cortar algo, cortar a legenda 'Free Harbor Jubilee' (o cartaz já a diz). Não obrigatório."
      ]
    },
    {
      "lente": "motion",
      "nota": 8,
      "problemas": [
        "Assentamento 1,03→1,00 uma vez, sombra solta e luz 120 ms atrás conferidos nos quadros 0,6–4,0; o retrato pousa sobre a borda do cartaz sem cobrir texto."
      ],
      "correcoes": []
    },
    {
      "lente": "fonte",
      "nota": 8,
      "problemas": [
        "Cartaz do Free Harbor Jubilee (LoC via Commons) e retrato de McKinley (LoC) em domínio público: sem crédito de licença na tela, conforme conferencia-midia.json; 'Photo from 1898' presente no retrato (aviso de ano, identidade §6). O cartaz é peça de época do próprio fato, sem aviso."
      ],
      "correcoes": []
    },
    {
      "lente": "tema",
      "nota": 9,
      "problemas": [],
      "correcoes": []
    },
    {
      "lente": "cobertura",
      "nota": 9,
      "problemas": [],
      "correcoes": []
    },
    {
      "lente": "cadencia",
      "nota": 7,
      "problemas": [
        "Sinaliza: o cartaz fica 7,5 s (0–7,47 s) como único plano, com só o push-in do RIG (0,0024/s) de movimento; o espelho previa dois enquadramentos do cartaz (p1 e p2) e a regência os fundiu em 'continua'. Está acima do teto de 6 s de foto parada (identidade §4.3), mas a mesa (luz, deriva) e a entrada de rótulos mantêm a cena viva; não derruba."
      ],
      "correcoes": [
        "Opcional: dar ao cartaz um movimento com propósito (câmera chega ao 'San Pedro' impresso em 'San Pedro held a…', 4,5–6,3 s), parando 0,3 s antes da palavra."
      ]
    },
    {
      "lente": "autoria",
      "nota": 10,
      "problemas": [],
      "correcoes": []
    },
    {
      "lente": "camadas",
      "nota": 10,
      "problemas": [],
      "correcoes": []
    },
    {
      "lente": "circulo",
      "nota": 9,
      "problemas": [],
      "correcoes": []
    }
  ],
  "julgamento": {
    "modo": "completo",
    "lentes_julgadas": [
      "espaco",
      "factual",
      "wordlock",
      "abordagem",
      "acessibilidade",
      "poluicao",
      "motion",
      "fonte",
      "tema",
      "cobertura",
      "cadencia",
      "autoria",
      "camadas",
      "circulo"
    ],
    "lentes_herdadas": [],
    "frames": 11,
    "porque": "Quadros olhados: 0.1, 0.6, 1.5, 2.6, 4.0, 6.7, 8.5, 9.0, 9.8, 11.0, 12.1. Portões lidos (out/los-angeles/_tmp/qc-cena-sem-mapa.txt, 25 cenas auditadas): todos verdes nesta cena (contrato, carga, colisão, tamanho, til-glifo, src-existe, fora-do-quadro, crédito-fantasma). mapa-vivo fora do portão. Julgamento sobre quadros do quadro.mjs com a pré-carga do canal."
  }
}
