{
  "cena": "s12",
  "aprovado": true,
  "gatesDuros": [],
  "lentes": [
    {
      "lente": "espaco",
      "nota": 8,
      "problemas": [
        "portões lidos, não remedidos: portao-margens veredito 0 com o sha1 de hoje (43ba8d26…) e o marca c647bf6c… igual ao sha1sum de marca/tokens.css, 46 itens medidos em 108 amostras (passo 0,1 s), sem itens e sem avisos; portao-mapa til: veredito 0 (3 textos) e rodape: veredito 0 (sem crédito de rodapé, correto: tudo domínio público); _portao.json: ok:true, falhas vazias, hash do HTML de hoje (qc-cena sem a pré-carga, cena sem mapa; o log por portão com contagem de itens não está gravado para as cenas sem mapa, só o carimbo). Nenhum NÃO MEDIDO. Sem exceção do crédito (a cena não tem crédito)",
        "observação: a página real (1.172 px de largura, a 1,3×) ocupa só o terço esquerdo do quadro; de 0 a 3,69 s a metade direita fica vazia, até a tira entrar. É o desenho (página à esquerda, tira à direita) e a página está lá desde o 1º quadro, mas é o tipo de espaço que o Lucas anotou na linha do tempo do Juneau (identidade §5, 'Espaço vazio esperando a voz incomoda'); não reprova porque há objeto, rótulo e câmera vivos",
        "recorte 4K de 10,4 s: o grifo 2 cobre exatamente 'would possess and exercise if it were the sovereign of / the territory'; tira em Courier Prime a 86 px (≥ 84), 11 palavras (≤ 12); nenhuma palavra cortada na faixa de texto; a nota de margem do compilador ficou fora do quadro (A10)"
      ],
      "correcoes": [
        "nenhuma ação obrigatória: o respiro é o regime declarado na regência; pousar a tira antes de 'all' (3,69 s) não serve, porque a voz ainda não disse a frase"
      ]
    },
    {
      "lente": "factual",
      "nota": 10,
      "problemas": [
        "conferido contra textos-tela.json › s12: ART. III · NOV. 18, 1903 · 33 STAT. 2235, tira 1 'all the rights, power and authority' e tira 2 '…would possess and exercise if it were the sovereign of the territory…' idênticas; a página é o 33 Stat. 2235 real (conferente: aprovado para a s12, domínio público federal); a citação bate com a voz e com o impresso (recorte 4K); asset correto"
      ],
      "correcoes": []
    },
    {
      "lente": "wordlock",
      "nota": 9,
      "problemas": [
        "tempos conferidos no words.json: 'Its' 95,21 s = pouso em 0,00; 'all' 98,89 s = grifo 1 e tira 1 em 3,69; 'would' 101,73 s = grifo 2 e tira 2 em 6,53; 'territory' termina em 105,07 s (9,87 local) e o grifo 2 fica aceso até o fim. O rótulo entra 150 ms depois do assentamento (identidade §4.4). Nada sobra depois da fala; o primeiro segundo está coberto (a página). Nenhum elemento foi atrasado por ritmo nesta cena: sem re-checagem pendente"
      ],
      "correcoes": []
    },
    {
      "lente": "abordagem",
      "nota": 9,
      "problemas": [
        "DOCUMENTO com a página real sobre a mesa: é o modo certo para a citação literal de um tratado ('um tratado não se filma; o registro dele é o papel', regência s12)"
      ],
      "correcoes": []
    },
    {
      "lente": "acessibilidade",
      "nota": 8,
      "problemas": [
        "em 2 s o leigo vê um tratado antigo com o trecho que a voz lê em destaque, e a tira ampliada resolve a legibilidade (a página a 1080p é ilegível, e a tira cobre isso)",
        "sinalização: 'STAT.' no rótulo (33 STAT. 2235) é sigla de citação sem explicação na tela ou na voz; é referência de documento (textos-tela), não afirmação, e não reprova"
      ],
      "correcoes": [
        "nenhuma ação obrigatória; se o Lucas quiser, 'STAT.' pode ir por extenso no rótulo, e a decisão é do redator-de-tela (textos-tela.json)"
      ]
    },
    {
      "lente": "poluicao",
      "nota": 9,
      "problemas": [
        "3 elementos (página, rótulo, tira) e 2 blocos de leitura (página + tira); teste de lastro: o rótulo é dado atribuível, a tira e o grifo são a própria frase da voz; nenhum texto órfão, nenhuma entidade HTML, nenhum tofu"
      ],
      "correcoes": []
    },
    {
      "lente": "motion",
      "nota": 8,
      "problemas": [
        "pouso da página 0,80 s com assentamento 1,03 → 1,00 uma vez, sem bounce (quadros 0,4 / 0,9 / 1,5 s); câmera 1,00 → 1,05 em 1,60–2,90 s e parada 0,79 s antes do grifo; nada se move nos últimos 250 ms (só a deriva); tira entra em 300 ms",
        "observação: de 0,95 a 3,69 s (2,7 s) só a deriva do RIG; é o regime respiro declarado na regência, sem mover texto na leitura"
      ],
      "correcoes": []
    },
    {
      "lente": "fonte",
      "nota": 10,
      "problemas": [
        "domínio público federal (govinfo, 33 Stat. 2235); conferente: crédito na tela 'nenhum obrigatório'; a cena não tem crédito e não precisa (identidade §7); crédito-fantasma: nenhum"
      ],
      "correcoes": []
    },
    {
      "lente": "tema",
      "nota": 9,
      "problemas": [
        "única cor com papel: --destaque a 35 % só no grifo (o que a voz diz); mesa do vídeo 2 com o still Landsat 9 do istmo, igual ao das irmãs de mesa; sem degradê além da luz da mesa, e a luz está por baixo do objeto"
      ],
      "correcoes": []
    },
    {
      "lente": "cobertura",
      "nota": 10,
      "problemas": [
        "o concreto central (a página do Art. III do tratado) está na tela desde o 1º quadro; 'territory' e 'sovereign' são abstratos"
      ],
      "correcoes": []
    },
    {
      "lente": "cadencia",
      "nota": 9,
      "problemas": [
        "um plano de 10,67 s com regime respiro declarado na regência e um só objeto qualificado (a página, dois grifos); a tira 1 → tira 2 renova a leitura em 6,53 s; o src único (tratado1903-stat33-p2235.jpg) aparece só como página + banda do mesmo scan, composição simultânea"
      ],
      "correcoes": []
    },
    {
      "lente": "autoria",
      "nota": 10,
      "problemas": [
        "página real do govinfo, sem redesenho; tira em tipografia declarada do canal (Courier Prime da folha, §3 e §5), que não finge ser o objeto; sem selo, brasão nem assinatura"
      ],
      "correcoes": []
    },
    {
      "lente": "camadas",
      "nota": 10,
      "problemas": [],
      "correcoes": []
    },
    {
      "lente": "circulo",
      "nota": 8,
      "problemas": [
        "eco de forma: s12, s13 e s14 seguidas usam o mesmo molde (página real sobre a mesa + rótulo + tira literal ampliada com grifo). O conteúdo é novo em cada uma (Art. III, o nome e o governador, os jurados), então informa, mas cansa; a s12 é a primeira da série, e o cartão do Art. III volta de propósito em s38 e s66 (callback declarado no espelho)"
      ],
      "correcoes": [
        "na s13 e na s14, variar o modelo onde der (posição da tira, um beat sem tira); a Arte decide, não é conserto obrigatório"
      ]
    }
  ]
}