{
  "cena": "s24",
  "aprovado": true,
  "gatesDuros": [],
  "lentes": [
    {
      "lente": "espaco",
      "nota": 8,
      "problemas": [
        "PORTÕES LIDOS (sha1 90e256de6390 = o HTML de hoje): _portao.json falhas [\"tamanho\"], e é só o crédito ([tamanho] [credito] \"Raimond Spekking / Wikimedia Commons · CC BY\" 60<72). EXCEÇÃO DO LUCAS: qc-tamanho, crédito a 60 px, \"60 px (Recomendado)\", 24/10/2026, gravada em qc/_excecoes-portao.json com o sha1 90e256de6390 (igual ao do HTML); o crédito vem de var(--fs-credito) = 60 px (:root no HTML), com data-qc-papel=\"credito\" e sem data-qc-credito=\"mapa\". portao-margens veredito 0 (6 itens, 50 amostras, avisos []); portao-mapa til = 0 (3 textos, \"é\" na Inter 500) e rodape v5 = 0 (8,36:1 @ 3,5 s, piso 3:1).",
        "No recorte 4K (t=4,0 s): legenda \"Cité de la Mer, Cherbourg\" e pílula \"Archimède\" legíveis e dentro das margens (a pílula termina em x ~3640); crédito em duas linhas na faixa y>1880, x 200 a ~1720. SINAL: a quebra depois de \"Commons\" deixa o separador \"· CC BY-SA 4.0\" começando a 2ª linha (o \"·\" órfão no início). Não reprova (o portão não deu aviso e o texto é o do textos-tela)."
      ],
      "correcoes": [
        "Opcional (editor-de-arte): manter o \"·\" no fim da 1ª linha ou tirá-lo na quebra, sem encolher o crédito."
      ]
    },
    {
      "lente": "factual",
      "nota": 9,
      "problemas": [
        "O arquivo é o Archimède em si, inteiro e de perfil, no museu da Cité de la Mer (conferente-de-midia: aprovado, sha256 65f8177c… = o do HTML). A legenda diz o lugar de origem (lugar_na_origem: Cité de la Mer museum, Cherbourg), o que deixa claro que a foto não é do mergulho; sem aviso do ano, certo para peça de museu (identidade §6; veredito aviso_de_ano: false). Os três textos batem letra a letra com o textos-tela f4eede4d (\"Cité de la Mer, Cherbourg\"; \"Archimède\" com o grave; crédito \"Raimond Spekking / Wikimedia Commons · CC BY-SA 4.0\"). Nada diz \"French Navy\"."
      ],
      "correcoes": []
    },
    {
      "lente": "wordlock",
      "nota": 8,
      "problemas": [
        "A legenda do lugar entra em 0,47 s (sem palavra que a convoque: é legenda de origem da foto, não rótulo da fala) e a pílula \"Archimède\" entra em 3,37 s (\"called\"), 0,33 s antes de \"Archimède\" (3,70 s). É a escolha do redator-de-tela (textos-tela: 1,5 s no ar, o piso do rótulo; \"Archimède\" termina a frase com só 1,17 s até o corte) e a Arte executou o t0 dele. Sinaliza, não reprova."
      ],
      "correcoes": []
    },
    {
      "lente": "abordagem",
      "nota": 9,
      "problemas": [
        "REGISTRO real de coisa nomeada, em tela cheia: o modo certo e o mais forte para \"a French bathyscaphe … called Archimède\". A foto de 5.858 px preenche a 0,66× (nenhum upscale), Ken Burns de 1,00 a ~1,097 em 4,87 s, com direção (rumo à torre com o nome), produto 0,72 (<= 1,4): identidade §4.4."
      ],
      "correcoes": []
    },
    {
      "lente": "acessibilidade",
      "nota": 9,
      "problemas": [
        "Em 2 s o espectador vê um submarino amarelo e marrom num salão, a legenda diz que é um museu e a pílula nomeia o Archimède. O que é \"a deep-diving craft\" fica com a voz, e o objeto fala por si."
      ],
      "correcoes": []
    },
    {
      "lente": "poluicao",
      "nota": 8,
      "problemas": [
        "Três textos (legenda, pílula, crédito; textos vivos 2) e a foto. SINAL: a foto traz, de hoje, visitantes e banners de bilheteria em francês (\"BILLET 3 SITES\", \"EXPLORATEUR DES ABYSSES\") na faixa de baixo, atrás do crédito; o conferente anotou que um recorte tiraria a maior parte, mas é enquadramento, não critério. Não atrapalha a leitura do crédito (8,36:1)."
      ],
      "correcoes": []
    },
    {
      "lente": "motion",
      "nota": 8,
      "problemas": [
        "Ken Burns linear com direção desde o primeiro quadro (s24@0.0 a s24@4.5: o enquadramento fecha devagar sobre a torre); nada se move em cima do texto depois que ele chega; sem pop. Respiro de uma foto de 4,87 s."
      ],
      "correcoes": []
    },
    {
      "lente": "fonte",
      "nota": 9,
      "problemas": [
        "Mídia com licença que exige atribuição (CC BY-SA 4.0) e o crédito está na tela, no formato \"<autor> / <acervo> · <licença>\" (identidade §7), a 60 px, contraste 8,36:1, do 1º ao último quadro (entra em 300 ms). Crédito-fantasma: não (a foto está na tela). O veredito aprovado do conferente casa com o sha256 do arquivo em uso (65f8177c)."
      ],
      "correcoes": []
    },
    {
      "lente": "tema",
      "nota": 9,
      "problemas": [
        "Registro real sem filtro, véu ou vinheta; as pílulas em --rotulo; nenhuma cor da marca disputando com a foto."
      ],
      "correcoes": []
    },
    {
      "lente": "cobertura",
      "nota": 10,
      "problemas": [
        "A coisa nomeada (o Archimède) aparece, a peça verdadeira."
      ],
      "correcoes": []
    },
    {
      "lente": "cadencia",
      "nota": 9,
      "problemas": [
        "Um objeto na fala (o batiscafo), um plano de 4,87 s com movimento contínuo; abaixo do teto de 6 s."
      ],
      "correcoes": []
    },
    {
      "lente": "autoria",
      "nota": 10,
      "problemas": [
        "Foto real, com fonte e licença registradas; nada de objeto desenhado para parecer o batiscafo."
      ],
      "correcoes": []
    },
    {
      "lente": "camadas",
      "nota": 10,
      "problemas": [],
      "correcoes": []
    },
    {
      "lente": "circulo",
      "nota": 9,
      "problemas": [
        "Primeira aparição do Archimède no vídeo; a s25 (o batiscafo, outro lote) o repete em outra linguagem, e a pergunta aberta s05 × s25 é da Sala."
      ],
      "correcoes": []
    }
  ],
  "julgamento": {
    "modo": "completo",
    "lentes_julgadas": [
      "espaco",
      "factual",
      "wordlock",
      "abordagem",
      "acessibilidade",
      "poluicao",
      "motion",
      "fonte",
      "tema",
      "cobertura",
      "cadencia",
      "autoria",
      "camadas",
      "circulo"
    ],
    "lentes_herdadas": [],
    "frames": 11,
    "porque": "Folha de 10 quadros (0 a 4,5 s, de 0,5 em 0,5 s, da linha do tempo, mais novos que o HTML) e um quadro 4K em t=4,0 s (recortes da legenda, da pílula e do crédito). Portões lidos, não rodados."
  }
}
