{
  "cena": "s11",
  "aprovado": true,
  "gatesDuros": [],
  "lentes": [
    {
      "lente": "espaco",
      "nota": 9,
      "problemas": [
        "Quadros olhados: 0,5, 2,2, 3,6, 5,0, 6,9, 8,5, 9,2, 10,0, 10,8, 11,4, 11,9 e 12,05 s. Três colunas de cartões entre as margens de 200 px, com o ano, o carimbo e o placar dentro de cada uma; o crédito em duas linhas no pé, de x ~200, dentro da faixa; o canto de 400 × 400 px livre. O cartão de 1974 sobe ~210 px acima dos outros (10,0 s em diante) sem sair da margem de topo.",
        "Portões que mediram e passaram, sem falha nem indefinido: contrato, colisão, tamanho, til-glifo, src-existe e fora-do-quadro, pelo qc-cena de 01/10/2026, 12:43 (carimbo em out/juneau/_portao.json, hash igual ao HTML atual). O que acima é do olho não contradiz nenhum portão."
      ],
      "correcoes": [],
      "origem": "julgada"
    },
    {
      "lente": "factual",
      "nota": 9,
      "problemas": [
        "Textos conferem com o textos-tela, letra a letra: 1960, 1962, AUGUST 1974, NO, NO, YES, 23,972 to 18,865, 32,325 to 26,542, 46,659 to 35,683 e Source: Alaska Division of Elections, 1960–1974 (o vencedor primeiro, ligado por 'to', forma AP). A factualidade dos placares é do verificador-de-fatos."
      ],
      "correcoes": [],
      "origem": "julgada"
    },
    {
      "lente": "wordlock",
      "nota": 8,
      "problemas": [
        "Os cartões entram com o ano: 1960 em 1,833 s e 1962 em 2,967 s (quadros de 2,2 e 3,6 s), o AUGUST 1974 em 4,9 s (quadro de 5,0 s, ainda subindo) e o YES com o placar em 6,567 s (quadro de 6,9 s); as mãos empurram o cartão a partir de 9,2 s ('a law that voters themselves put on the ballot'; quadros de 9,2 e 10,0 s).",
        "Observação: de 0 a 1,8 s a tela mostra só os três vãos tracejados (quadro de 0,5 s), enquanto a voz já diz 'Voters rejected moving the capital in' (0 a 1,7 s); o 1960 só entra em 'nineteen' (1,833 s), como a regência manda (não antecipar a voz). Os vãos anunciam a estrutura de três colunas, por isso sinaliza e não reprova."
      ],
      "correcoes": [],
      "origem": "julgada"
    },
    {
      "lente": "abordagem",
      "nota": 9,
      "problemas": [
        "DADO sobre --papel, o modelo certo para três resultados com placar (identidade §5, tabela: o gráfico com série vai sobre --papel); o placar vem do documento oficial, mas não é a transcrição de uma cédula."
      ],
      "correcoes": [],
      "origem": "julgada"
    },
    {
      "lente": "acessibilidade",
      "nota": 8,
      "problemas": [
        "Em 2 s lê-se: três votações, duas com NO e uma com YES, cada uma com o placar. Observação: o NO em --destaque e o YES em --contraparte ficam a ~1,7:1 sobre o --papel (calculado dos tokens), abaixo dos 3:1 de elemento gráfico que a própria identidade cita (nota do --neutro, §1); a caixa e a letra são grandes e o placar em tinta escura carrega a leitura, por isso sinaliza e não reprova.",
        "Observação: as mãos de pictograma (9,2 a 11,9 s) são cinza sobre o --papel, pequenas e sem texto; o gesto 'o eleitor empurra a cédula' lê-se pela cédula que sobe, e a frase ('a law that voters themselves put on the ballot') está na voz."
      ],
      "correcoes": [],
      "origem": "julgada"
    },
    {
      "lente": "poluicao",
      "nota": 9,
      "problemas": [
        "De 4,9 s ao fim: três cartões (cada um com ano, carimbo e placar contados como uma peça), o AUGUST 1974 e as mãos = 4 a 5 elementos, abaixo do teto de 6 (quadro de 10,0 s).",
        "qc-carga passou (qc-cena de 01/10/2026, 12:43 (carimbo em out/juneau/_portao.json, hash igual ao HTML atual)). A contagem de elementos acima é do olho nos quadros e o portão não a contradiz."
      ],
      "correcoes": [],
      "origem": "julgada"
    },
    {
      "lente": "motion",
      "nota": 8,
      "problemas": [
        "Cada carimbo e cada cartão têm entrada com easing (quadros de 2,2, 3,6 e 5,0 s) e o cartão de 1974 sobe de baixo do quadro, recebe o YES e é empurrado pelas mãos (diferença 9,7 e 7,4 entre quadros vizinhos em 9,5 e 10,0 s). Observação: a cena fica parada de 0 a 1,8 s (só os vãos tracejados, diferença 0,1) e de 10,5 a 12,1 s (cartões assentados, diferença 1,0); são trechos curtos, abaixo do teto de 6 s, mas o quadro não carrega nada nesse tempo.",
        "qc-video-avanca: sem <video> na cena, nada a medir."
      ],
      "correcoes": [],
      "origem": "julgada"
    },
    {
      "lente": "fonte",
      "nota": 9,
      "problemas": [
        "Source: Alaska Division of Elections, 1960–1974 em 76 px na faixa, a partir de 1,8 s (junto com o primeiro cartão; ausente do quadro de 0,5 s, sem crédito-fantasma) até o fim, cobrindo os três resultados. Nenhuma mídia de _media/ na cena.",
        "qc-credito-fantasma passou (qc-cena de 01/10/2026, 12:43 (carimbo em out/juneau/_portao.json, hash igual ao HTML atual)). qc-rodape-contraste devolveu \"sem crédito de rodapé\" sem medir, embora o quadro de 6,9 s mostre o crédito; medi eu no quadro 4K do clipe, com o mesmo método: 6.65:1 (6,9 s) e 6.64:1 (11,4 s), piso 3:1. Não é o portão."
      ],
      "correcoes": [],
      "origem": "julgada"
    },
    {
      "lente": "tema",
      "nota": 8,
      "problemas": [
        "DADO sobre --papel: NO em --destaque e YES em --contraparte (os dois lados, como a identidade §2 manda), tinta escura sobre --papel para o ano e o placar, sem degradê nem véu. Observação: o --destaque marca aqui um lado da votação e não o protagonista do vídeo (Juneau, laranja nos mapas), uma leitura que o conceito declara; o contraste das duas cores sobre o papel está em acessibilidade."
      ],
      "correcoes": [],
      "origem": "julgada"
    },
    {
      "lente": "cobertura",
      "nota": 9,
      "problemas": [
        "Cada resultado tem o seu cartão com o ano, o carimbo e o placar oficial, e o 'ballot initiative' tem as mãos que empurram a cédula."
      ],
      "correcoes": [],
      "origem": "julgada"
    },
    {
      "lente": "cadencia",
      "nota": 8,
      "problemas": [
        "Dois beats (4,8 s e 7,3 s). O segundo é longo, mas troca de objeto três vezes (a cédula sobe, recebe o YES, é empurrada). O começo é lento: 1,8 s só com vãos tracejados."
      ],
      "correcoes": [],
      "origem": "julgada"
    },
    {
      "lente": "autoria",
      "nota": 10,
      "problemas": [],
      "correcoes": [],
      "origem": "julgada"
    },
    {
      "lente": "camadas",
      "nota": 10,
      "problemas": [],
      "correcoes": [],
      "origem": "julgada"
    },
    {
      "lente": "circulo",
      "nota": 9,
      "problemas": [
        "O carimbo NO/YES e o placar voltam em outras cenas (s01, s35, s60 e s62), de propósito; o degrau novo é a fila de três votações e as mãos."
      ],
      "correcoes": [],
      "origem": "julgada"
    }
  ]
}