{
  "cena": "s15",
  "aprovado": true,
  "gatesDuros": [],
  "lentes": [
    {
      "lente": "espaco",
      "nota": 9,
      "problemas": [
        "Sem falha de portão (qc-cena ok, 'tamanho' verde: a cena não tem crédito; portao-margens 0, 4 itens medidos). Uma pílula por plano, 128 px, em x 200 / y 160; nada abaixo de y 1880; canto inferior direito vazio."
      ],
      "correcoes": [],
      "origem": "julgada"
    },
    {
      "lente": "factual",
      "nota": 9,
      "problemas": [
        "Rótulos conferem com textos-tela e com o lugar_na_origem: 'Lima' (≤ Costa Verde, Lima) e 'Miraflores, Lima' (= o título do s15-b). Nenhum número nem dado atribuível na cena."
      ],
      "correcoes": [],
      "origem": "julgada"
    },
    {
      "lente": "wordlock",
      "nota": 9,
      "problemas": [
        "Conferido no words.json (−147,767): 'Lima' entra em 0,3 ('stays' 0,253, 'fog,' 0,733): rótulo de lugar do plano, sem palavra própria na fala, decisão do redator, aceitável. 'Miraflores, Lima' em 3,5 ('see' 3,623). O corte em 3,2 cai em 'You' (3,223)."
      ],
      "correcoes": [],
      "origem": "julgada"
    },
    {
      "lente": "abordagem",
      "nota": 9,
      "problemas": [
        "Dois registros reais em tela cheia (neblina na Costa Verde; céu cinza sobre Miraflores): o modo certo para 'fog, low cloud and drizzle'."
      ],
      "correcoes": [],
      "origem": "julgada"
    },
    {
      "lente": "acessibilidade",
      "nota": 9,
      "problemas": [
        "A neblina pesada do plano A explica a frase de cara. O plano B (céu baixo e cinza sobre os prédios) acompanha 'the system… when it weakens' sem mostrar o enfraquecimento, que é abstrato; o mapa da s16 o explica a seguir. Sinal leve, não derruba."
      ],
      "correcoes": [],
      "origem": "julgada"
    },
    {
      "lente": "poluicao",
      "nota": 10,
      "problemas": [],
      "correcoes": [],
      "origem": "julgada"
    },
    {
      "lente": "motion",
      "nota": 9,
      "problemas": [
        "O plano A anda (diferença média 8/255 entre t 0,1 e 3,1, o guindaste e o píer derivam); o plano B é um hyperlapse que avança forte (21/255 entre 3,35 e 6,25). Nada congela. Rótulo em 300 ms."
      ],
      "correcoes": [],
      "origem": "julgada"
    },
    {
      "lente": "fonte",
      "nota": 10,
      "problemas": [
        "Sem crédito na tela e correto: Envato não exige (conferencia-midia, credito_na_tela 'nenhum'); sem dado atribuível; sem crédito-fantasma (portao-mapa rodape: 'sem crédito de rodapé'). _PROCEDENCIA.json casa, pela URL, com os vereditos s15-a e s15-b, 'aprovado' e mesmo_item true. O plano B usa a janela 7,0 → 10,133 do clipe, antes dos 12 s (o Parque del Amor com gente, que o veredito manda evitar)."
      ],
      "correcoes": [],
      "origem": "julgada"
    },
    {
      "lente": "tema",
      "nota": 9,
      "problemas": [
        "A bruma cinza é a cor do assunto (a tampa de nuvem de Lima); registro sem filtro; consistente com as irmãs."
      ],
      "correcoes": [],
      "origem": "julgada"
    },
    {
      "lente": "cobertura",
      "nota": 9,
      "problemas": [
        "O concreto central da frase (neblina, nuvem baixa) está na tela. A garoa ('drizzle') não se vê, secundário. 'The system' não é objeto fotografável."
      ],
      "correcoes": [],
      "origem": "julgada"
    },
    {
      "lente": "cadencia",
      "nota": 9,
      "problemas": [
        "Dois planos de 3,2 e 3,13 s, dois arquivos distintos; o segundo é 'a second take', como a regência manda, e não repete o primeiro."
      ],
      "correcoes": [],
      "origem": "julgada"
    },
    {
      "lente": "autoria",
      "nota": 10,
      "problemas": [],
      "correcoes": [],
      "origem": "julgada"
    },
    {
      "lente": "camadas",
      "nota": 10,
      "problemas": [],
      "correcoes": [],
      "origem": "julgada"
    },
    {
      "lente": "circulo",
      "nota": 9,
      "problemas": [
        "Sinal leve de eco de forma: aérea da Costa Verde / Miraflores já apareceu na s03 (beat 1). Aqui o degrau novo é o clima (neblina e céu cinza contra o dia aberto da s03), o que a frase pede; sem reprova."
      ],
      "correcoes": [],
      "origem": "julgada"
    }
  ]
}
