{
  "cena": "s40",
  "aprovado": true,
  "gatesDuros": [],
  "lentes": [
    {
      "lente": "espaco",
      "nota": 8,
      "problemas": [
        "r4b: clipe 4K válido (carimbo = sha1 46852165…, 2160p). Olhei 0,1/1,0/2,0/5/10/16/21,0/21,9/22,6/23,3/24,0/24,45 s. Pílulas, legenda 'year each became a city', cota e a legenda de Wilmington dentro das margens; faixa y>1880 só com crédito; canto 400×400 livre. Crédito 'Source: Los Angeles County annexation records' a 56 px (var(--fs-credito), data-qc-papel=\"credito\"); crédito de mapa a 56 px, rodapé v5 8,36:1 sobre a terra mais clara do contraste C (lê-se).",
        "exceção do Lucas: qc-tamanho, crédito a 56 px, 07/10/2026 (\"Quero reduzir para 56px\"). É a única reprovação do qc-cena na cena ([tamanho] [credito] 56<72, _tmp/art-r4b/central/qc-cena.txt) e a exceção está gravada em _excecoes-portao.json com o sha1 novo 468521653bcb83c51aab7cf68acede50f5f85b1d, igual ao do HTML e ao do carimbo. til-glifo NÃO MEDIDO no qc-cena (mapa), coberto pelo portao-mapa til (exit 0, 88 tiles 2xx, 54 instantes); conferir exit 0 (a lista de falhas dele é só o crédito a 56 px, com exceção). gatesDuros vazio por isso."
      ],
      "correcoes": []
    },
    {
      "lente": "factual",
      "nota": 8,
      "problemas": [
        "r4b: nada de dado mudou; pílulas, cota e legenda seguem o textos-tela; anel em 'tip' (23,753 s) e a legenda 'Wilmington's limits of 1909' como no r4. Desvios r4 (pílulas saem em 23,45 s; 'Source:' em 21,82 s): aceitos no r4 e mantidos."
      ],
      "correcoes": []
    },
    {
      "lente": "wordlock",
      "nota": 7,
      "problemas": [
        "[r4, inalterado na r4b] Medido: pílulas em 'towns' (Torrance 20,718, Gardena 20,838, Lomita 20,958, Carson 21,078 s; voz 'towns' 20,72) ✓ em ordem de ano; a cota 'ABOUT 15 MILES (1906)', a linha de medida e 'county land, 1906' saem em 20,35 s, antes de 'towns' ✓ (R6.1 a, b); anel em 'tip' 23,753 ✓.",
        "[r4, inalterado na r4b] Desvio declarado (a linha 'Source: Los Angeles County annexation records' entra em 21,82 s e não em 20,567 do textos-tela): ACEITO. O qc-carga conta a linha como estreia de texto e o teto é 4 por janela de 1 s; com ela junto da 1ª pílula seriam 5. É gate medido, e o texto não mudou.",
        "[r4, inalterado na r4b] SINALIZA: de ~21,08 a 21,82 s os quatro anos estão na tela sem a legenda que os explica e sem o crédito (a legenda 'year each became a city' chega 0,7–1,1 s depois das pílulas; a voz diz 'weren't cities yet' só em 22,0 s). Consequência do mesmo teto de estreias; a leitura se completa em 21,8 s. A legenda 'Wilmington's limits of 1909' ficou ~0,8 s no ar como último item da legenda das cores (aviso do qc-carga, permitido por identidade §6)."
      ],
      "correcoes": [
        "Opcional, só se o central quiser fechar a janela: estrear 'year each became a city' em ~21,3 s e adiar a linha Source para depois de 22,0 s; precisa re-medir o qc-carga --estreias."
      ]
    },
    {
      "lente": "abordagem",
      "nota": 9,
      "problemas": [],
      "correcoes": []
    },
    {
      "lente": "acessibilidade",
      "nota": 8,
      "problemas": [
        "[r4, inalterado na r4b] Os quatro anos entram na palavra 'towns', em ordem de ano, e o anel marca a ponta em 'tip'. R6.1 resolvido: a legenda deixou de parecer subtítulo de uma pílula só (agora é caixa do canto de cima à esquerda, longe do Carson). Observação anterior (11,2–16,3 s: câmera recuando sem '(1906)') não mudou."
      ],
      "correcoes": []
    },
    {
      "lente": "poluicao",
      "nota": 7,
      "problemas": [
        "[r4, inalterado na r4b] Entre 21,8 e 23,45 s convivem a faixa, quatro pílulas e a legenda: 6 elementos, o teto (identidade §4.2); o crédito não conta. SINALIZA como pior extremo; nada entra ali (o anel só chega em 23,753 s, com as pílulas já abaixo de 5 %). qc-carga passou (pior janela 4 estreias, teto 4)."
      ],
      "correcoes": []
    },
    {
      "lente": "motion",
      "nota": 8,
      "problemas": [
        "r4b, corte s39→s40 (item s40-corte-pula, media): RESOLVIDO. Lado a lado o último quadro da s39 e o quadro 0 da s40: o fio laranja da faixa cai na mesma posição horizontal (~66 % da largura) e com o mesmo comprimento nos dois, e a perna 'v' de 0 a 1,6 s leva ao enquadramento da cena; a cor sobe de 35 % a 85 % de 1,7 a 2,9 s junto do esmaecimento da folha (quadros 0,1/1,0/2,0 s: sem salto). Câmera contínua nas demais pernas; anel com um pulso; pílulas em 300 ms, saem juntas. Sem degrau."
      ],
      "correcoes": []
    },
    {
      "lente": "fonte",
      "nota": 8,
      "problemas": [
        "[r4, inalterado na r4b] Mapa antigo em domínio público sem crédito de mídia: correto (identidade §7). '18.64 SQ MI' tem a própria folha impressa na tela; os anos têm a linha 'Source: Los Angeles County annexation records' (decisão do central sobre 'Source:' em dado). Crédito de mapa em todos os quadros. Exceção do crédito a 56 px citada em espaco."
      ],
      "correcoes": []
    },
    {
      "lente": "tema",
      "nota": 9,
      "problemas": [
        "r4b, contraste C do satélite (identidade §6): a terra sai mais clara e dessaturada e o laranja do protagonista, o contorno branco e as pílulas se leem em todos os quadros; não há camada de água escura nesta cena e o mar natural é quase preto, sem borda. Uma cor = um significado mantido (laranja = Los Angeles, verde-água = Wilmington). Sem véu."
      ],
      "correcoes": []
    },
    {
      "lente": "cobertura",
      "nota": 9,
      "problemas": [],
      "correcoes": []
    },
    {
      "lente": "cadencia",
      "nota": 8,
      "problemas": [
        "[r4, inalterado na r4b] 24,5 s sem plano de footage; cinco trocas de enquadramento (folha→satélite, bloco→fio, aproximação, recuo, descida à ponta)."
      ],
      "correcoes": []
    },
    {
      "lente": "autoria",
      "nota": 10,
      "problemas": [],
      "correcoes": []
    },
    {
      "lente": "camadas",
      "nota": 10,
      "problemas": [],
      "correcoes": []
    },
    {
      "lente": "circulo",
      "nota": 9,
      "problemas": [],
      "correcoes": []
    }
  ]
}