{
  "cena": "s69",
  "aprovado": true,
  "gatesDuros": [],
  "lentes": [
    {
      "lente": "espaco",
      "nota": 8,
      "problemas": [
        "PORTÕES LIDOS (sha1 d62970d062ae = o HTML de hoje): _portao.json falhas ['tamanho'] = só o crédito 'Source: IHO Publication M-3, 2026' a 60<72, coberto pela exceção do Lucas: qc-tamanho, crédito a 60 px, 24/10/2026, \"60 px (Recomendado)\" (qc/_excecoes-portao.json, sha1 igual ao do HTML de hoje); portao-margens 0 (11 medidos, 53 amostras, 3 objetos em passagem e 4 isentos: a folha descendo); portao-mapa til v5 0; rodape v5 0 (8,78:1). O crédito é de 60 px (var(--fs-credito)), com data-qc-papel='credito', na faixa y > 1880 e antes de x 1720.",
        "Folha inteira na margem (x 280–3.560 no 4K), o rasgo a 263 px da última linha (piso 240) e nenhuma palavra cortada nos quadros de 0,5, 2,0, 3,5 e 5,0 s; as fitas ficam sobre o branco da folha.",
        "SINALIZA: o cabeçalho quebra em '(IHO)' / '· RESOLUTION 02/2023', e o '·' abre a segunda linha como um marcador solto. Resposta à pergunta 7 da arte (EF3): preferir a quebra DEPOIS do '·'."
      ],
      "correcoes": [
        "editor-de-arte (só se a Sala tocar a cena): quebrar o cabeçalho depois do '·' ('...(IHO) ·' / 'RESOLUTION 02/2023'); o texto do textos-tela não muda."
      ]
    },
    {
      "lente": "factual",
      "nota": 9,
      "problemas": [
        "A folha confere com o textos-tela f4eede4d palavra por palavra: o cabeçalho 'INTERNATIONAL HYDROGRAPHIC ORGANIZATION (IHO) · RESOLUTION 02/2023', o corpo literal (M-3, 2026, p. 124) e o crédito. O grifo cai só no texto impresso ('neither political nor oceanographic or, more generally, environmental significance whatsoever' e 'Hydrographic Offices may continue to adopt their own limits'), nunca nas palavras da voz (PB106). Sem logo, selo nem timbre. A fidelidade do trecho à M-3 é do laudo de fatos."
      ],
      "correcoes": []
    },
    {
      "lente": "wordlock",
      "nota": 9,
      "problemas": [
        "O grifo 1 varre a partir de 1,90 s (voz 'no' em 1,91 s: no quadro de 2,0 s está em 'neither po…') e o grifo 2 a partir de 3,333 s (voz 'not' em 3,35 s: em 3,5 s está em 'Hydrographi…'). Os dois ficam acesos até o fim. A folha pousa em 0–0,8 s e a câmera para em 1,60 s, mais de 0,3 s antes do primeiro grifo; as posições da folha em 2,0, 3,5 e 5,0 s são as mesmas (só a deriva)."
      ],
      "correcoes": []
    },
    {
      "lente": "abordagem",
      "nota": 9,
      "problemas": [
        "DOCUMENTO recriado em tipografia (identidade §5; midia.md §7.1: a página real da M-3 não tem licença conferida e os scans do disco são '-prova'): a recriação fiel, com a fonte citada, é o modo certo. A folha é um objeto, um bloco."
      ],
      "correcoes": []
    },
    {
      "lente": "acessibilidade",
      "nota": 8,
      "problemas": [
        "O parágrafo tem ~56 palavras em Courier de 86 px; quem lê só os grifos recebe as duas ideias ('neither political nor oceanographic…' e 'may continue to adopt their own limits'), que são as da fala. Em ~2 s o leigo entende que é um documento da organização e vê as duas frases marcadas."
      ],
      "correcoes": []
    },
    {
      "lente": "poluicao",
      "nota": 8,
      "problemas": [
        "Um objeto e um bloco (a folha), nenhum rótulo; nenhum texto órfão (o cabeçalho é o 'The organization'; os grifos, as frases da voz). SINALIZA: o '·' solto do cabeçalho (acima)."
      ],
      "correcoes": []
    },
    {
      "lente": "motion",
      "nota": 8,
      "problemas": [
        "Pouso em 0,8 s (a folha desce e assenta 1,03 → 1,00), push-in até 1,60 s, depois só a deriva; o grifo varre palavra a palavra; repouso nos 250 ms finais (diferença média 1,02 entre 4,5 e 5,0 s). A câmera não anda durante o grifo."
      ],
      "correcoes": []
    },
    {
      "lente": "fonte",
      "nota": 9,
      "problemas": [
        "Crédito 'Source: IHO Publication M-3, 2026' no formato 'Source: <instituição>, <ano>' (identidade §7), 60 px, do 1º ao último quadro. A recriação traz a fonte, o visual é o do canal (Courier Prime sobre a mesa, a moldura da s08) e não há brasão, selo, timbre ou logo (midia.md §7.1 e §7.6). Nenhum arquivo '-prova' na tela. Contraste do crédito 8,78:1 (portao-mapa rodape v5). exceção do Lucas: qc-tamanho, crédito a 60 px, 24/10/2026, \"60 px (Recomendado)\" (qc/_excecoes-portao.json, sha1 igual ao do HTML de hoje)."
      ],
      "correcoes": []
    },
    {
      "lente": "tema",
      "nota": 8,
      "problemas": [
        "A folha em --papel sobre a mesa; o grifo em --destaque a 35%, como a identidade §5 manda para DOCUMENTO (não é o protagonista); o still da mesa é o de Porto Rico (desfocado, nada se lê)."
      ],
      "correcoes": []
    },
    {
      "lente": "cobertura",
      "nota": 9,
      "problemas": [
        "'The organization' é o cabeçalho da folha; a coisa nomeada (a resolução) é o próprio objeto. Não há imagem real que faltasse: a página real não tem licença conferida."
      ],
      "correcoes": []
    },
    {
      "lente": "cadencia",
      "nota": 9,
      "problemas": [
        "5,17 s, um plano de documento com dois grifos em movimento: abaixo do teto de 6 s e com mudança a cada 1,4 s."
      ],
      "correcoes": []
    },
    {
      "lente": "autoria",
      "nota": 9,
      "problemas": [
        "Folha recriada em tipografia declarada, no padrão do canal, sem logo, selo, timbre ou assinatura e com a fonte na tela: não afirma ser a página da IHO. Cumpre a saída 'tipografia declarada' da lente."
      ],
      "correcoes": []
    },
    {
      "lente": "camadas",
      "nota": 10,
      "problemas": [],
      "correcoes": []
    },
    {
      "lente": "circulo",
      "nota": 8,
      "problemas": [
        "Avança (um documento novo, um trecho novo). SINALIZA: é a terceira folha recriada na mesma mesa e moldura (s62, s69 e s73, depois da s08); o conteúdo é novo, e só o modelo se repete. Varia-se o modelo se a Sala quiser; não reprova. TROCAS olhadas: s68 → s69 (mapa → folha, corte seco de regime) e s69 → s70 (folha → mapa), sem defeito."
      ],
      "correcoes": []
    }
  ]
}